Field1,Field3_text,Field3_links,Time
부산맛집 서면밀면 으로 여행 첫 스타트 !,부산맛집 서면밀면 으로 여행 첫 스타트 ! 이번 부산 여행의 첫 포스팅은 제가 여행 첫 스타트로 갔던 곳으로 먼저 적어보려고 해요 :) 낮 시간에 도착해서 점심을 뭐먹지 ? 하다 간단한 거 먹자고 면 종류 어때 하면서 이것저것 찾아보다가 부산맛집 으로 아주 유명한 서면밀면 이 !! 블로그 후기가... ,https://blog.naver.com/qqq86/222891961271,2022. 10. 10.
"부산 맛집, 부산역 신발원 군만두 필수!",그 중에서도 저희가 가려한 #부산맛집 바로 #부산신발원 입니다!! 부산역 맛집 신발원은 워낙 유명해서 본점이 있고 바로 옆 건물에 흰색 간판인 신관이 또 있어요! 자세한 위치는 지도를 참고해주세요! 여기 빨간 간판이 부산 맛집 신발원 본점입니다! 처음에 오른쪽 사진 찍고 뭐지 날씨가 습해서... ,https://blog.naver.com/gns5660/222821335302,2022. 7. 20.
부산 맛집 내돈내산 생선구이 자갈치시장 여기가 가본곳중 괜찮았어요.,ㅠㅠ 이래서 부산 맛집은 해산물이구나 싶다. 내돈내산 주문을 하려는데 마음은 회이지만 너무 아침이어서 생선으로 결정했다. 메뉴판이 정말... 부산 맛집 내돈내산으로 다녀온 곳이 정말 많은데 기억을 더듬어 써보긴 해야겠다. 부전에서는 주차장곰장어 양정은 칼국수와 컴포즈커피가 좀 괜찮다.... ,https://blog.naver.com/saiber44/222905994678,2022. 10. 21.
금수복국 해운대 술먹고올껄 부산 맛집,개념 맛집특.. 각종효능도 준비되어있고요 아주그냥 진시황 안부럽죠 복어아이템 자랑하는 복어덕후 사장님.. 하긴 이렇게 장사 잘되면 복어를 베고 자도 행복할듯 금수복국 잘먹고 갑니다! #부산맛집 #금수복국 #해운대금수복국 #금수복국본점 #복국 #복어탕 #복튀김 #복무침 #복껍질,https://blog.naver.com/mynamco/222842461739,2022. 8. 8.
"부산 맛집 해운대암소갈비집, 여긴 꼭 간다! 예약방법(테이블링 원격줄서기 안됨!)",잘 먹었습니다!!! #부산맛집 #해운대암소갈비집 #해운대암소갈비 #해운대암소갈비집예약 #해운대암소갈비집웨이팅 #해운대암소갈비집테이블링 #해운대암소갈비집오픈 #해운대암소갈비집오픈런 #해운대암소갈비집테이블링오픈 #해운대암소갈비집생갈비 #해운대암소갈비집양념갈비,https://blog.naver.com/god2010god/222893507179,2022. 10. 6.
부산 송도 맛집 부산 맛집 감칠맛 끝장,내부를 둘러보자마자 탁 트인 구조의 부산 맛집은 포근함과 세월이 느껴지는 정감넘치는 분위기였죠. 전체적으로 번쩍 광이 날 정도로 잘 닦여져... 식감만큼은 부산 맛집의 찬들과 뒤쳐지지 않게 쫄깃하고 찰기 넘쳐 취향저격이었어요. 그러는사이에 바글거리며 끓여져 나온 해물탕은 언뜻 봐도... ,https://blog.naver.com/poohaha817/222912360988,19시간 전
부산 맛집 중국식 찐만두 신발원 + 군스빽립 폭립 먹방후기,부산 맛집 중국식 찐만두 신발원 + 군스빽립 폭립 먹방후기 지난 연휴에는 친구들과 바다도 볼겸 부산으로 여행을 떠났다가 예전부터 가보고 싶었던 부산 맛집에도 다녀왔어요. 육즙 넘치는 립과 흔하지 않은 필리핀요리를 합리적인 금액대로 만끽하고왔던곳이라 소개해드려요. 군스빽립 주소... ,https://blog.naver.com/mongpop/222895031266,2022. 10. 8.
부산 맛집 일본의 분위기를 보여주는 오라이멘,부산 맛집 일본의 분위기를 보여주는 오라이멘 부산 맛집 일본식 포장마차 분위기를 보여주는 오라이멘에 다녀왔어요. 최근에 떠오르고 있는 핫플이기도 해서 꼭 다녀오고 싶었거든요. 아마 아시는 분들도 많으실 거라고 생각을 해요. ㅎㅎ 인기 많은 곳이라서 가기 전부터 웨이팅을 각오하고... ,https://blog.naver.com/yunt80/222852134227,2022. 8. 20.
"내맘대로 부산맛집01 : 이자까야 비슈, 성원정 양대창","⭐️⭐️⭐️⭐️⭐️ 바로 2차 때리러~ 성원정양대창 여기가 부산맛집인지 저녁 이른 시간부터 줄이 어어어엄청 길게 서있었다 검색해서 간 곳은... 와인가게 보틀샵, 부산 도넛맛집 두넛샵이 궁금하다면 여기로 부산 실내데이트 하는 곳을 찾는다면 여기로 #국내여행 #부산여행 #부산맛집 #가을여행",https://blog.naver.com/oebd6749/222881624725,2022. 9. 22.
10월 제철음식 부산 맛집 기장끝집 밀키트로 쉽게 전복죽 끓이는법,전복 손질하고 전복죽 끓이는법 찾아서 조리해도 뭔가 부족하다 느껴지신다면 부산 맛집 기장끝집 밀키트 챙기고 간편하게 즐겨보시면 좋을 거 같아요. #10월제철음식 #전복죽끓이는법 #전복죽밀키트 #전복죽 #건강죽 #전복죽맛집 #기장끝집,https://blog.naver.com/goindol71/222909913907,2022. 10. 25.
부산 맛집/ 서면밀면,있어서 부산 맛집으로 강추해도 되나 좀 헷갈리긴 하지만 전 경상도 출신인데 맛있던데용....? ㅋㅋ 하여튼 맛있음!!! 부산 맛집 서면밀면은 서면역에서 가깝긴 한데 술 마시러/ 쇼핑하러/ 카페투어로 찾는 서면 쪽이라기 보다는 조금 조용한 동네라 의외의 위치인? 근데 요즘 서면 술집 맛집이 이... ,https://blog.naver.com/rolo_ggo/222754452975,2022. 6. 1.
[부산맛집/기장철마맛집] 철마연밥,"가게와 관련된 위치 및 정보는 포스팅 하단을 참조해주세요 :) ▲ 부산맛집, 기장맛집, 철마맛집, 철마연밥 부산 기장군 철마면에 위치한 철마연밥... ▲ 부산맛집, 기장맛집, 철마맛집, 철마연밥 대기시간이 지나고, 가게로 들어서봅니다. 딱히 개인적인 공간은 없었고 전체 홀테이블이 한눈에... ",https://blog.naver.com/ckwkdrms/222831148698,2022. 8. 2.
"부산맛집 추천, 서빙로봇 푸두봇이 가져다주는 전복요리 탐복","직접 먹어보니 부산맛집 이유가 있더라구요. 큼지막한 전복이 가득 들어있는데다 고소한 전복 내장이 맛있었어요. 게다가 서빙로봇 푸두봇이... 메뉴는 캐치테이블로 미리 예약을 했는데 필수주문은 부산맛집 탐복 대표메뉴인 탐복죽+탐복밥+탐복구이이며 5인 이상은 2개, 9인 이상은 3개를... ",https://blog.naver.com/sweetydy/222890913304,2022. 10. 3.
[부산맛집/해운대맛집] 장어덮밥 카이센동 맛집 ‘해목’ 해운대점,맥주도 빠질 수 없어서 한잔씩^^ 가격은 다른 음식집에 비해 비싸지만 음식의 재료들이 하나하나 신선하고 구성또한 너무 좋고 정말 맛있었어요. 부산에 방문하신다면 부산맛집으로 해목 추천드려요^^ #해목 #해운대 #부산맛집 #부산여행 #카이센동 #장어덮밥 #히츠마부시 #해운대맛집 #맛집추천 #장어,https://blog.naver.com/msy5088/222892453850,2022. 10. 5.
부산 맛집 : 해운대 타이가텐푸라에서 먹은 인생 텐동,부산 맛집 : 해운대 타이가텐푸라에서 먹은 인생 텐동 부산에서 먹고 온 것들중 딸아이가 인생 텐동이었다고 칭찬했던 해운대 타이가텐푸라 후기 올립니다 저녁시간에 이동을 한건데 해운대쪽은 항상 차가 많이 밀리는듯 해요ㅠㅠ 차가 밀려서 힘들게 도착을 했는데 음식이 아주 만족스러워서... ,https://blog.naver.com/eloiz/222901074306,2022. 10. 16.
"[해운대암소갈비]부산맛집,해운대맛집,해운대암소갈비,부산암소갈비,해운대암소갈비집","태어나서 처음 먹어보는 맛인데 맛있오!!! 후식으로 나온 배 꿀맛 왠걸,, 넘 배불러서 배는 맛만 보려고 했는데 여기는 배까지 인생배면 못남김,,, ㅋㅋ. 남편일아 마지막까지 감탄하면서 먹은 해운대암소갈비 무조건 추천!!!! 찾아오는 길 #해운대암소갈비집 #해운대맛집 #부산소갈비 #부산맛집",https://blog.naver.com/tnwl3801/222900348142,2022. 10. 14.
[부산맛집] 부산에서 3대 밀면하면 가야밀면 찐 후기~~(내돈내산),"[부산맛집] 부산에서 3대 밀면하면 가야밀면 찐 후기~~(내돈내산) 안녕하세요~ 주말권 금요일 오후 잘보내고 계신가요??? 이번주는 너무 바빠서... ㅎㅎㅎ TV에서 보는 광안리,해운대 해변이나 귀에서 피가 나도록 들은 부산 맛집들... 기대 만땅~~컨셉은 맛집탐방으로 잡았습니다. 아무래도 음식은... ",https://blog.naver.com/blindclub1/222882439343,2022. 9. 23.
부산맛집추천 광안리 광안목고기집 직접 목살 구워주는 광안목 먹고왔어요!,부산맛집추천 광안리 광안목고기집 직접 목살 구워주는 광안목 먹고왔어요! #부산맛집추천 #광안리고기집 #광안목 #광안목고기집 #광안리목살 #광안리맛집 이렇게 직접 구워주는 고기집 광안리 광안목 두꺼운고기 먹고 싶을때면 생각나는곳이 되어버렸어요 ㅋㅋ 주차장 위치 가게 바로 앞... ,https://blog.naver.com/bomhae_/222885534342,2022. 9. 27.
[부산 맛집] 송도 떡볶이 맛집 _ 신전떡볶이 송도 해수욕장점,[부산 맛집] 송도 해수욕장 떡볶이 맛집 신전떡볶이 송도점 2022. 10 연휴에 신전떡볶이를 포장해 와서 먹어보았습니다. 3일 붙어있는 연휴는 집밥만 계속 해먹이긴 힘들어요 하하하 이럴땐 신전떡볶이 히히 저희집이랑 가까운 신전떡볶이 송도해수욕장점에서 포장해갔습니다. ✔️주소 - 부산 서구... ,https://blog.naver.com/eunsungju/222891430944,2022. 10. 4.
부산맛집 오션뷰 라발스호텔 알리아농,ALIANON 부산맛집 코스요리 “알리아농 부산 라발스호텔점 알리아농은 모던 프렌치 스타일 뷔페 레스토랑 입니다. 알리아농 이름은 식자재를 뜻하는... 대박 ‘부산맛집’이랍니다 코스요리 하나하나 각각의 비쥬얼이나 맛이 너무 훌륭해서 처음부터 끝까지 감동하면서 먹을 수 있구요 코스요리의... ,https://blog.naver.com/djanus/222701618675,2022. 4. 15.
큰바다소년 단골 부산 맛집 10 + 여름 휴가 일정,"단골 부산 맛집 10, 휴가일정 소개합니다. 1.해운대 파라다이스호텔 부산 레스토랑 본격적인 휴가철이 시작되면 해운대 바닷가에 위치한... 부산 맛집 여름 휴가일정 없이 오후 4시부터 0시까지 주 7일 영업하네요. 4.서면 요시노스시 일본풍의 다다미 방이 있는 부산 스타일의 스시야입니다.... ",https://blog.naver.com/benjo11/222826830659,2022. 7. 24.
"내맘대로 부산맛집2 : 전포동 스테디어, 광안리 에쏘",부산여행의 마지막을 장식 할 부산 맛집을 찾아 떠났다!! 꼬꼬!! 새벽에 눈 뜨자마자 폭풍검색해서 찾은 ‘스테디어’ 네이버에 검색해보면... 스테디어 우리맘대로 부산맛집이라 불러드립니다~ ⭐️⭐️⭐️⭐️⭐️ 다음은 후식 커피는 어디가서 먹지하다가 돌아오게된 광안리..! 30분정도 차를... ,https://blog.naver.com/oebd6749/222885797675,2022. 9. 27.
부산맛집 오감만족 해산물 바다뷰,부산맛집 오감만족 해산물 바다뷰 부산 여행 맛집 하면~ 무조건 회나 해산물 먹고 가아하죠! 동부산이 요즘 부산맛집 해산물도 있고 근처에 바다뷰 보이는 카페 드라이브 하기 참 좋습니다. 부산 기장해녀촌 연화리에는 신선한 해산물이 가득한 해물 포장마차촌이 존재합니다. 내비게이션에... ,https://blog.naver.com/pt42/222727183749,2022. 5. 17.
"부산 맛집리스트, 부산여행 리스트, 부산가볼만한곳","여름하면 바다, 바다하면 푸산이죠~~ 부산에서 유명한 맛집 리스트, 부산여행때 가야되는 곳 알아볼까요 이글로 총정리~~~ 부산 맛집 리스트 이건 휴대폰에 저장해두세요[출처 자취생으로 살아남기] 이거 정말 부산 맛집들 유명한곳만 모아진거에요 부산여행 밥집은 해운대, 광안리 위주로 하시면... ",https://blog.naver.com/midary1009/222829387535,2022. 7. 26.
[부산맛집/마린시티맛집] 긴자 해운대 마린시티점,"자세한 위치 및 내용은 포스팅 하단을 참조해주세요 :) ▲ 부산맛집, 해운대 마린시티 맛집, 긴자 해운대 마린시티점 긴자 해운대마린시티점은... ▲ 부산맛집, 해운대 마린시티 맛집, 긴자 해운대 마린시티점 상가 엘리베이터를 타고 건물3층으로 이동해봅니다. 분위기가 꽤 좋습니다. 실제, 상견례... ",https://blog.naver.com/ckwkdrms/222733331822,2022. 5. 15.
2022년 부산맛집 리스트 4부 [블챌]주간일기11,"<2022년 부산맛집 리스트 내가 아는 소소한 맛집 4부> 22. 용호동 W스퀘어 맛집 타블도트 브런치 샐러드, 스테이크, 스파게티로 유명한 w스퀘어... 2022년 부산맛집리스트에 소개하던 곳이 벌써 28개나 되었다. 최근 다녀온 소소한 부산 맛집들을 담아 한 주 7개씩 소개하였는데, 아직 소개하고픈 곳이... ",https://blog.naver.com/surfergold/222852100566,2022. 8. 18.
부산맛집 명지맛집 부안집,부산맛집 명지맛집 고기맛집 ‘부안집’ 영업시간 - 16:00 ~ 23:00 주차 - 오른편 전용주차장 명지 국제신도시 택지에 위치한 ‘부안집’ 체인점이지만 제일 가까워서 방문! 명지 부안집은 8테이블있고 저녁시간이라 웨이팅할까걱정했는데 다행히도 자리가 있었다 (웨이팅싫어) 명지 목구멍을... ,https://blog.naver.com/dlek051/222876016979,2022. 9. 16.
부산맛집 : 기장 해녀할매집 전복죽 포장해서 먹었습니다,부산맛집 : 기장 해녀할매집 전복죽 포장해서 먹었습니다 며칠전의 부산여행에서 둘째날에 기장쪽을 다녀왔습니다 기장에서 연화리 죽도와 대변항 사이에 있는 해녀할매집에 들러서 전복죽을 포장해왔습니다 먹고 올 시간이 안되는데 전복죽이 먹고는 싶어서 그냥 포장을 하게 되었는데... ,https://blog.naver.com/eloiz/222901008533,2022. 10. 16.
부산맛집 우리 돼지국밥 여행 1일차 맛점 성공,언니가 부산에 여러 번 왔었기 때문에 언니만 졸졸 따라다녔던 길치쓰..ㅎ 그래서 부산역에서 내리자마자 언니 따라서 부산맛집 우리 돼지국밥에... 놀러 온 사람들이 많은 곳도 물론 맛집이겠지만 여기 사는 사람들이 오는 곳이 찐 맛집 아니냐구요~ 부산맛집 우리 돼지국밥 메뉴판 생각보다... ,https://blog.naver.com/babodmsl/222860123474,2022. 8. 28.
부산 맛집 #호아빈 해운대점 베트남음식을 먹을 수 있는 마린시티맛집,"그러다가 브레이크타임 직전에 오게 된 곳 :) 부산 맛집 호아빈 해운대점 :) 마린시티에 위치하고 있는 곳으로 여기도 브레이크타임이 있긴 했는데 다른 곳보다는 조금 늦은 편이라 그나마 우리가 밥을 먹을 수 있었다. 부산 맛집 호아빈 해운대점 메뉴판 :) 쌀국수부터 볶음면, 볶음밥, 튀김류... ",https://blog.naver.com/inkyungidd/222877729582,2022. 9. 25.
10월 제철음식 전복죽 끓이는법 부산맛집 기장끝집 전복죽 밀키트,10월 제철음식 전복죽 끓이는법 전복죽 끓이는법 전복 따로 손질할 필요없이 부산맛집 기장끝집 전복죽 밀키트로 10월 제철음식 전복이 듬뿍 들어간 전복죽 만들어봐요 (✿◡‿◡) ▲ 부산맛집 기장끝집 본점 주소 : 부산 기장군 기장읍 기장해안로 895 부산 기장에서 전복죽 맛집으로 유명한... ,https://blog.naver.com/real_ruby/222912267896,21시간 전
부산여행 부산맛집 채스우드,"부산맛집 찾아보고 미리 예약하고선 다녀왔어용 거의 예약제로만 운영하는듯 ,,? 주차공간은 따로 없어서 근처 길가에다 하고 걸어갔서유 가정집을... 직원분께서 친절하시고 따로 요청하지 않아도 알아서 더 가져다주시더라구요, 들기름 메밀국수 먹으러 또 가고싶네유 #부산여행 #부산맛집 #채스우드",https://blog.naver.com/k_woojung/222853635121,2022. 8. 20.
부산맛집) 기장끝집,아닌티에서 하루 밤 자고 아이와 함께 아침은 먹어야 하고 생각나서 가본곳 부산맛집으로 이미 소문도 나고 인플언서들도 공구해서. 나는... 안 찍었으 가족과 오시면 행복한 소풍길 가족끼리 마니 오시더라구요 또 부산가면 먹고 싶어지네요 #기장끝집 #전복죽맛집 #부산맛집,https://blog.naver.com/hobb2561/222888725792,2022. 9. 30.
토요일은밥이좋아 기장 칠암사계 소금빵 부산맛집,소금빵으로 줄서는 부산맛집 웨이팅맛집 칠암사계 칠암사계 부산맛집 #토요일은밥이좋아기장 #토요일은밥이좋아 소금빵기장 처음 가본 날은 평일 저녁이어서 사람이 그리 많지는 않았습니다 3층이랑 루프탑은 우리끼리 다 차지~야호~ 토요일은밥이좋아 편한 의자가 없는게 딱 요즘 카페... ,https://blog.naver.com/djanus/222707920211,2022. 4. 22.
"부산맛집, 기장철마 한우맛집 형제가든 - 감성충만의 부산(기장)여행#2","부산맛집, 기장철마 한우맛집 형제가든- 감성충만의 부산(기장)여행#2 감성충만의 부산(기장)여행#2 형제가든, 재방문의사가 있다. 한우좋았고... https://blog.naver.com/dazzling_jun/222880025266 #형제가든 #기장맛집 #기장 #부산 #여행 #맛집 #부산맛집_형제가든 #철마형제가든 #감성충만의와인앤다인... ",https://blog.naver.com/dazzling_jun/222882831321,2022. 9. 24.
